{
  "schema_version": 1,
  "edition_id": "2026-09-30-morning",
  "checker": {
    "tool": "codex",
    "model": "gpt-6"
  },
  "stories": [
    {
      "id": "animal-welfare-six-years-new-agency",
      "sentences": [
        {
          "location": "headline",
          "sentence": 0,
          "verdict": "supported",
          "passage": "Der vil ske en tredobling af strafferammen for de mest alvorlige brud på dyrevelfærdsreglerne fra to til seks år.",
          "cites": [
            "kristeligt_dagblad"
          ]
        },
        {
          "location": "deck",
          "sentence": 0,
          "verdict": "supported",
          "passage": "Der oprettes også en ny styrelse, som har til hovedopgave at stå for de pågældende kontroller. ... Det er landmændene selv, der skal betale det meste af regningen gennem et øget kontrolgebyr. ... Formanden for Danske Svineproducenter, Jeppe Bloch Nielsen, kalder planen for et \"mediestunt\".",
          "cites": [
            "kristeligt_dagblad"
          ]
        },
        {
          "location": "standard[0]",
          "sentence": 0,
          "verdict": "supported",
          "passage": "Det fremgår af en ny akutplan, som regeringen sammen med Alternativet tirsdag præsenterede ved et pressemøde i Justitsministeriet. ... Der vil ske en tredobling af strafferammen for de mest alvorlige brud på dyrevelfærdsreglerne fra to til seks år.",
          "cites": [
            "kristeligt_dagblad"
          ]
        },
        {
          "location": "standard[0]",
          "sentence": 1,
          "verdict": "supported",
          "passage": "Der oprettes en styrelse for kontrol med dyrevelfærd i Justitsministeriet, og kontrollen, som har haltet alvorligt de senere år, skal øges med 50 procent.",
          "cites": [
            "kristeligt_dagblad"
          ]
        },
        {
          "location": "standard[1]",
          "sentence": 0,
          "verdict": "supported",
          "passage": "Det indebærer blandt andet, at der fremover skal være flere og bedre kontroller med grise-, kvæg- og fjerkræbesætningerne. Fremover skal der være mindst to kontrollanter ved hvert besøg. ... Planen skal allerede gælde fra 2027. For at kunne lykkes med den øgede kontrol ansættes der over 100 flere medarbejdere.",
          "cites": [
            "kristeligt_dagblad"
          ]
        },
        {
          "location": "standard[1]",
          "sentence": 1,
          "verdict": "supported",
          "passage": "Regningen for akutplanens øgede kontroller ventes at blive 120 millioner kroner i 2027 og derefter stige til 160 millioner kroner om året frem mod 2029. Det er landmændene selv, der skal betale det meste af regningen gennem et øget kontrolgebyr.",
          "cites": [
            "kristeligt_dagblad"
          ]
        },
        {
          "location": "standard[2]",
          "sentence": 0,
          "verdict": "supported",
          "passage": "Det er dog - noget atypisk - Alternativets politiske leder, Franciska Rosenkilde, som får lov at præsentere akutpakken ... - Nu rydder vi op efter årtiers svigt af dyrene, siger Franciska Rosenkilde.",
          "cites": [
            "kristeligt_dagblad"
          ]
        },
        {
          "location": "standard[3]",
          "sentence": 0,
          "verdict": "supported",
          "passage": "Formanden for Danske Svineproducenter, Jeppe Bloch Nielsen, kalder planen for et \"mediestunt\". ... - Det er styrelsen, der ikke har gjort sit arbejde, siger han.",
          "cites": [
            "kristeligt_dagblad"
          ]
        },
        {
          "location": "standard[3]",
          "sentence": 1,
          "verdict": "supported",
          "passage": "- I dag betaler vi omkring 4000 kroner, men vi har i dag selv regnet på, at det kan komme til at koste os 19.000 kroner.",
          "cites": [
            "kristeligt_dagblad"
          ]
        },
        {
          "location": "callouts[0]",
          "sentence": 0,
          "verdict": "supported",
          "passage": "Der vil ske en tredobling af strafferammen for de mest alvorlige brud på dyrevelfærdsreglerne fra to til seks år.",
          "cites": [
            "kristeligt_dagblad"
          ]
        },
        {
          "location": "callouts[1]",
          "sentence": 0,
          "verdict": "supported",
          "passage": "- Nu rydder vi op efter årtiers svigt af dyrene, siger Franciska Rosenkilde.",
          "cites": [
            "kristeligt_dagblad"
          ]
        }
      ],
      "guideline_notes": []
    },
    {
      "id": "fairford-vans-no-explosives",
      "sentences": [
        {
          "location": "headline",
          "sentence": 0,
          "verdict": "supported",
          "passage": "Der blev ikke fundet nogen improviserede sprængladninger i de varevogne, britisk politi stoppede ved luftbasen Fairford tidligt søndag morgen. Politiet har dog beslaglagt \"en mængde benzin\" fra varevognene.",
          "cites": [
            "kristeligt_dagblad"
          ]
        },
        {
          "location": "deck",
          "sentence": 0,
          "verdict": "supported",
          "passage": "Fem mænd, der blev anholdt søndag, er fortsat under efterforskning, efter at de blev løsladt mod kaution mandag. ... air base used by US bombers",
          "cites": [
            "kristeligt_dagblad",
            "ft"
          ]
        },
        {
          "location": "standard[0]",
          "sentence": 0,
          "verdict": "supported",
          "passage": "Der blev ikke fundet nogen improviserede sprængladninger i de varevogne, britisk politi stoppede ved luftbasen Fairford tidligt søndag morgen. Politiet har dog beslaglagt \"en mængde benzin\" fra varevognene. Det meddeler det britiske politis antiterrorenhed tirsdag.",
          "cites": [
            "kristeligt_dagblad"
          ]
        },
        {
          "location": "standard[1]",
          "sentence": 0,
          "verdict": "supported",
          "passage": "Fem mænd, der blev anholdt søndag, er fortsat under efterforskning, efter at de blev løsladt mod kaution mandag.",
          "cites": [
            "kristeligt_dagblad"
          ]
        },
        {
          "location": "standard[1]",
          "sentence": 1,
          "verdict": "supported",
          "passage": "Laurence Taylor, chef for Storbritanniens nationale antiterrorpoliti. - Men jeg vil gerne understrege, at det var en efterforskningsmæssig beslutning",
          "cites": [
            "kristeligt_dagblad"
          ]
        },
        {
          "location": "standard[1]",
          "sentence": 2,
          "verdict": "supported",
          "passage": "Suspect in RAF Fairford incident called 999 shortly before arrest ... One of the five men arrested near RAF Fairford called 999 himself",
          "cites": [
            "ft",
            "bbc"
          ]
        },
        {
          "location": "standard[2]",
          "sentence": 0,
          "verdict": "supported",
          "passage": "Tirsdag har britisk politi også oplyst, at der er blevet foretaget ransagninger af ejendomme i London. Efterforskningen omkring flybasen Fairford er ved at blive trappet ned og forventes at være helt afsluttet onsdag.",
          "cites": [
            "kristeligt_dagblad"
          ]
        }
      ],
      "guideline_notes": []
    },
    {
      "id": "trump-ai-morally-binding-deal",
      "sentences": [
        {
          "location": "headline",
          "sentence": 0,
          "verdict": "supported",
          "passage": "Trump vil lade AI-branchen styre sig selv i stedet for at indføre regler ... - Det er moralsk forpligtende, synes jeg.",
          "cites": [
            "kristeligt_dagblad"
          ]
        },
        {
          "location": "deck",
          "sentence": 0,
          "verdict": "supported",
          "passage": "Aftalen er ud over Donald Trump underskrevet af topcheferne for Google, Anthropic, Meta, OpenAI, Nvidia og Elon Musk ... Da aftalen kun er \"moralsk bindende\", har det ikke nogen konsekvenser, hvis virksomhederne ikke lever op til den.",
          "cites": [
            "kristeligt_dagblad"
          ]
        },
        {
          "location": "standard[0]",
          "sentence": 0,
          "verdict": "supported",
          "passage": "Amerikanske teknologivirksomheder skal hellere selv regulere kunstig intelligens, frem for at staten skal fastsætte regler. ... Aftalen er ud over Donald Trump underskrevet af topcheferne for Google, Anthropic, Meta, OpenAI, Nvidia og Elon Musk",
          "cites": [
            "kristeligt_dagblad"
          ]
        },
        {
          "location": "standard[0]",
          "sentence": 1,
          "verdict": "supported",
          "passage": "efter et frokostmøde tirsdag ... På et spørgsmål fra en journalist om, hvorvidt det er en juridisk bindende aftale, svarer præsidenten: - Det er moralsk forpligtende, synes jeg.",
          "cites": [
            "kristeligt_dagblad"
          ]
        },
        {
          "location": "standard[1]",
          "sentence": 0,
          "verdict": "supported",
          "passage": "virksomheder bag kunstig intelligens-modeller bør indføre fire lag af sikkerhed ... en uafhængig ekstern part for at udføre uafhængige vurderinger af, om kontroller fungerer som tilsigtet. ... \"med tiden kan give mening\" at lave aftalen om til egentlige love og regler.",
          "cites": [
            "kristeligt_dagblad"
          ]
        },
        {
          "location": "standard[1]",
          "sentence": 1,
          "verdict": "supported",
          "passage": "Da aftalen kun er \"moralsk bindende\", har det ikke nogen konsekvenser, hvis virksomhederne ikke lever op til den.",
          "cites": [
            "kristeligt_dagblad"
          ]
        },
        {
          "location": "standard[2]",
          "sentence": 0,
          "verdict": "supported",